{
  "schema": "urn:aihq:core:recipe:1.1.0",
  "id": "guidance-file",
  "description": "Deliver project guidance",
  "inputs": {
    "text": {
      "type": "string",
      "required": true,
      "maxLength": 65536
    }
  },
  "materials": [],
  "targets": [
    "project"
  ],
  "prerequisites": [],
  "operations": [
    {
      "id": "write",
      "purpose": "Write shared project guidance",
      "kind": "file.write",
      "scope": "project",
      "target": {
        "root": "project",
        "segments": [
          {
            "literal": "TEAM.md"
          }
        ]
      },
      "content": {
        "input": "text"
      },
      "requires": [],
      "checks": []
    }
  ],
  "checks": []
}
